{
  "schema_version": 1,
  "id": "microsoft.access-reviews",
  "title": "Access Reviews",
  "vendor": "microsoft",
  "parent": "microsoft.entra-id",
  "requires": null,
  "category": null,
  "description": null,
  "links": [
    {
      "title": "Documentation",
      "url": "https://learn.microsoft.com/entra/id-governance/access-reviews-overview"
    }
  ],
  "targets": [],
  "plans": []
}
