{
  "schema_version": 1,
  "id": "microsoft.teams-essentials",
  "title": "Teams Essentials",
  "vendor": "microsoft",
  "parent": null,
  "requires": null,
  "category": "Meetings, calling, and chat",
  "description": null,
  "links": [
    {
      "title": "Documentation",
      "url": "https://www.microsoft.com/microsoft-teams/essentials"
    }
  ],
  "targets": [],
  "plans": []
}
