{
  "schema_version": 1,
  "id": "microsoft.people-in-viva",
  "title": "People in Viva",
  "vendor": "microsoft",
  "parent": null,
  "requires": null,
  "category": "Microsoft Viva",
  "description": null,
  "links": [
    {
      "title": "Documentation",
      "url": "https://techcommunity.microsoft.com/blog/microsoftvivablog/people-in-microsoft-viva-%E2%80%93-putting-people-at-the-center-of-the-employee-experien/3633223"
    }
  ],
  "targets": [],
  "plans": []
}
