{
  "schema_version": 1,
  "id": "microsoft.planner-project",
  "title": "Planner & Project",
  "vendor": "microsoft",
  "parent": null,
  "requires": null,
  "category": "Project and task management",
  "description": null,
  "links": [
    {
      "title": "Documentation",
      "url": "https://www.microsoft.com/microsoft-365/planner/microsoft-planner-plans-and-pricing"
    }
  ],
  "targets": [],
  "plans": []
}
