{
  "schema_version": 1,
  "id": "microsoft.data-estate-insights",
  "title": "Data Estate Insights",
  "vendor": "microsoft",
  "parent": null,
  "requires": null,
  "category": "Microsoft Purview",
  "description": null,
  "links": [
    {
      "title": "Documentation",
      "url": "https://learn.microsoft.com/purview/legacy/concept-insights"
    }
  ],
  "targets": [],
  "plans": []
}
