{
  "schema_version": 1,
  "id": "microsoft.windows-conditional-access",
  "title": "Windows Conditional Access",
  "vendor": "microsoft",
  "parent": null,
  "requires": null,
  "category": "Identity and access management",
  "description": null,
  "links": [
    {
      "title": "Documentation",
      "url": "https://learn.microsoft.com/windows-server/identity/ad-fs/operations/configure-device-based-conditional-access-on-premises"
    }
  ],
  "targets": [],
  "plans": []
}
