{
  "schema_version": 1,
  "id": "microsoft.microsoft-sentinel",
  "title": "Microsoft Sentinel",
  "vendor": "microsoft",
  "parent": null,
  "requires": null,
  "category": "Threat protection",
  "description": null,
  "links": [
    {
      "title": "Documentation",
      "url": "https://www.microsoft.com/security/business/siem-and-xdr/microsoft-sentinel-siem"
    }
  ],
  "targets": [],
  "plans": []
}
