{
  "schema_version": 1,
  "id": "microsoft.defender-for-iot-eiot-5-devices",
  "title": "Defender for IoT - eIoT (5 devices)",
  "vendor": "microsoft",
  "parent": null,
  "requires": null,
  "category": "Threat protection",
  "description": null,
  "links": [
    {
      "title": "Documentation",
      "url": "https://learn.microsoft.com/azure/defender-for-iot/organizations/concept-enterprise"
    }
  ],
  "targets": [],
  "plans": []
}
